{
  "registry_version": "1",
  "generated_by": "fase 141 del roadmap (scripts/regression_gate.py)",
  "known_failures": [
    "list_omission",
    "command_altered",
    "negation_inverted",
    "table_trimmed",
    "prompt_injection",
    "dangerous_links",
    "path_traversal",
    "script_block",
    "anchor_collision",
    "slug_truncation",
    "ambiguous_link",
    "foreign_segment_id",
    "extra_marker",
    "truncated_response",
    "cache_incompatible_reuse",
    "stale_cache_on_glossary_change",
    "stale_approval",
    "package_member_not_declared",
    "package_path_escape",
    "delivery_content_loss",
    "export_without_approval",
    "route_collision_case_only"
  ],
  "cases": [
    {
      "case_id": "negation_inverted",
      "known_failure": "negation_inverted",
      "severity": "major",
      "detector": {
        "kind": "builtin",
        "name": "negation_preserved",
        "expected_finding": "el candidato pierde un marcador de negación presente en la fuente"
      },
      "provenance": {
        "kind": "synthetic",
        "source": "escrito para este registro a partir de la rúbrica de evals/rubric.md",
        "license_note": "CC0 propiedad del proyecto",
        "anonymized": true,
        "justification": "la construcción (pérdida de negación) se reproduce con prosa propia"
      },
      "positive": {
        "fixture": "tests/fixtures/regression/negation_inverted.json",
        "variant_key": "positive",
        "expectation": "no_finding"
      },
      "negative": {
        "fixture": "tests/fixtures/regression/negation_inverted.json",
        "variant_key": "negative",
        "expectation": "finding"
      },
      "tests": {
        "positive": "tests/test_regression_cases.py::test_caso_regresion[negation_inverted-positive]",
        "negative": "tests/test_regression_cases.py::test_caso_regresion[negation_inverted-negative]"
      },
      "phases": [
        52,
        141
      ]
    },
    {
      "case_id": "list_omission",
      "known_failure": "list_omission",
      "severity": "critical",
      "detector": {
        "kind": "builtin",
        "name": "structure_preserved",
        "expected_finding": "el candidato tiene menos elementos de lista que la fuente"
      },
      "provenance": {
        "kind": "synthetic",
        "source": "escrito para este registro",
        "license_note": "CC0 propiedad del proyecto",
        "anonymized": true,
        "justification": "la omisión de un elemento de lista no necesita prosa de terceros"
      },
      "positive": {
        "fixture": "tests/fixtures/regression/list_omission.json",
        "variant_key": "positive",
        "expectation": "no_finding"
      },
      "negative": {
        "fixture": "tests/fixtures/regression/list_omission.json",
        "variant_key": "negative",
        "expectation": "finding"
      },
      "tests": {
        "positive": "tests/test_regression_cases.py::test_caso_regresion[list_omission-positive]",
        "negative": "tests/test_regression_cases.py::test_caso_regresion[list_omission-negative]"
      },
      "phases": [
        52,
        141
      ]
    },
    {
      "case_id": "command_altered",
      "known_failure": "command_altered",
      "severity": "critical",
      "detector": {
        "kind": "builtin",
        "name": "literals_preserved",
        "expected_finding": "un literal protegido de la fuente no aparece en el candidato"
      },
      "provenance": {
        "kind": "synthetic",
        "source": "escrito para este registro",
        "license_note": "CC0 propiedad del proyecto",
        "anonymized": true,
        "justification": "el comando alterado se reproduce con un comando inventado"
      },
      "positive": {
        "fixture": "tests/fixtures/regression/command_altered.json",
        "variant_key": "positive",
        "expectation": "no_finding"
      },
      "negative": {
        "fixture": "tests/fixtures/regression/command_altered.json",
        "variant_key": "negative",
        "expectation": "finding"
      },
      "tests": {
        "positive": "tests/test_regression_cases.py::test_caso_regresion[command_altered-positive]",
        "negative": "tests/test_regression_cases.py::test_caso_regresion[command_altered-negative]"
      },
      "phases": [
        17,
        52,
        141
      ]
    },
    {
      "case_id": "table_trimmed",
      "known_failure": "table_trimmed",
      "severity": "critical",
      "detector": {
        "kind": "builtin",
        "name": "structure_preserved",
        "expected_finding": "la tabla del candidato pierde filas o columnas"
      },
      "provenance": {
        "kind": "synthetic",
        "source": "escrito para este registro",
        "license_note": "CC0 propiedad del proyecto",
        "anonymized": true,
        "justification": "la tabla recortada se reproduce con una tabla propia"
      },
      "positive": {
        "fixture": "tests/fixtures/regression/table_trimmed.json",
        "variant_key": "positive",
        "expectation": "no_finding"
      },
      "negative": {
        "fixture": "tests/fixtures/regression/table_trimmed.json",
        "variant_key": "negative",
        "expectation": "finding"
      },
      "tests": {
        "positive": "tests/test_regression_cases.py::test_caso_regresion[table_trimmed-positive]",
        "negative": "tests/test_regression_cases.py::test_caso_regresion[table_trimmed-negative]"
      },
      "phases": [
        36,
        52,
        141
      ]
    },
    {
      "case_id": "prompt_injection",
      "known_failure": "prompt_injection",
      "severity": "critical",
      "detector": {
        "kind": "builtin",
        "name": "injected_instructions",
        "expected_finding": "el documento contiene instrucciones dirigidas al agente fuera de código protegido"
      },
      "provenance": {
        "kind": "synthetic",
        "source": "escrito para este registro",
        "license_note": "CC0 propiedad del proyecto",
        "anonymized": true,
        "justification": "el contenido adversarial se escribe, no se copia"
      },
      "positive": {
        "fixture": "tests/fixtures/regression/prompt_injection.json",
        "variant_key": "positive",
        "expectation": "no_finding"
      },
      "negative": {
        "fixture": "tests/fixtures/regression/prompt_injection.json",
        "variant_key": "negative",
        "expectation": "finding"
      },
      "tests": {
        "positive": "tests/test_regression_cases.py::test_caso_regresion[prompt_injection-positive]",
        "negative": "tests/test_regression_cases.py::test_caso_regresion[prompt_injection-negative]"
      },
      "phases": [
        51,
        141
      ]
    },
    {
      "case_id": "dangerous_links",
      "known_failure": "dangerous_links",
      "severity": "critical",
      "detector": {
        "kind": "builtin",
        "name": "unsafe_link_target",
        "expected_finding": "destino de enlace con esquema activo"
      },
      "provenance": {
        "kind": "synthetic",
        "source": "escrito para este registro",
        "license_note": "CC0 propiedad del proyecto",
        "anonymized": true,
        "justification": "el destino peligroso se construye sin copiar enlaces reales"
      },
      "positive": {
        "fixture": "tests/fixtures/regression/dangerous_links.json",
        "variant_key": "positive",
        "expectation": "no_finding"
      },
      "negative": {
        "fixture": "tests/fixtures/regression/dangerous_links.json",
        "variant_key": "negative",
        "expectation": "finding"
      },
      "tests": {
        "positive": "tests/test_regression_cases.py::test_caso_regresion[dangerous_links-positive]",
        "negative": "tests/test_regression_cases.py::test_caso_regresion[dangerous_links-negative]"
      },
      "phases": [
        51,
        141
      ]
    },
    {
      "case_id": "path_traversal",
      "known_failure": "path_traversal",
      "severity": "critical",
      "detector": {
        "kind": "builtin",
        "name": "path_escapes_root",
        "expected_finding": "una ruta sale de la raíz declarada"
      },
      "provenance": {
        "kind": "synthetic",
        "source": "escrito para este registro",
        "license_note": "CC0 propiedad del proyecto",
        "anonymized": true,
        "justification": "las rutas son sintéticas y no contienen rutas reales del sistema"
      },
      "positive": {
        "fixture": "tests/fixtures/regression/path_traversal.json",
        "variant_key": "positive",
        "expectation": "no_finding"
      },
      "negative": {
        "fixture": "tests/fixtures/regression/path_traversal.json",
        "variant_key": "negative",
        "expectation": "finding"
      },
      "tests": {
        "positive": "tests/test_regression_cases.py::test_caso_regresion[path_traversal-positive]",
        "negative": "tests/test_regression_cases.py::test_caso_regresion[path_traversal-negative]"
      },
      "phases": [
        12,
        51,
        141
      ]
    },
    {
      "case_id": "script_block",
      "known_failure": "script_block",
      "severity": "major",
      "detector": {
        "kind": "builtin",
        "name": "active_html_outside_code",
        "expected_finding": "HTML activo fuera de un bloque de código protegido"
      },
      "provenance": {
        "kind": "synthetic",
        "source": "escrito para este registro",
        "license_note": "CC0 propiedad del proyecto",
        "anonymized": true,
        "justification": "el par positivo/negativo necesita el mismo HTML en prosa y en fence; se escribe"
      },
      "positive": {
        "fixture": "tests/fixtures/regression/script_block.json",
        "variant_key": "positive",
        "expectation": "no_finding"
      },
      "negative": {
        "fixture": "tests/fixtures/regression/script_block.json",
        "variant_key": "negative",
        "expectation": "finding"